{
  "artifact": "EvidenceBundle",
  "run_id": "2026-10-23-agent-framework-adoption",
  "records": [
    {
      "evidence_id": "E1",
      "question_id": "RQ1",
      "claim": "As of 2026-10-24, the most-downloaded open-source agent frameworks by weekly downloads are LangChain (39.1M/week), AI SDK (18.4M/week), Claude Agent SDK (15.1M/week), and LangGraph (14.4M/week).",
      "source_title": "Best AI Agent Frameworks in 2026: LangGraph, CrewAI, OpenAI Agents SDK and More",
      "source_url": "https://agentgid.com/guides/best-ai-agent-frameworks/",
      "publisher": "AgentGid",
      "publication_date": "unknown",
      "retrieved_evidence": "\"The short version As of Oct 24, 2026: - Most downloaded: LangChain (39.1M/week), AI SDK (18.4M/week), Claude Agent SDK (15.1M/week), LangGraph (14.4M/week).\" Page also states: \"AgentGid tracks 42 of them; all are open source and free to install.\"",
      "source_type": "independent",
      "credibility": "Independent framework tracker; publishes its methodology and dataset (gravity.fast CSV); states data date explicitly",
      "support_relation": "supports"
    },
    {
      "evidence_id": "E2",
      "question_id": "RQ1",
      "claim": "As of 2026-10-24, the open-source agent frameworks with the most GitHub stars are LangChain (148K), MetaGPT (71K), AutoGen (61.5K), and CrewAI (60K).",
      "source_title": "Best AI Agent Frameworks in 2026: LangGraph, CrewAI, OpenAI Agents SDK and More",
      "source_url": "https://agentgid.com/guides/best-ai-agent-frameworks/",
      "publisher": "AgentGid",
      "publication_date": "unknown",
      "retrieved_evidence": "\"Most GitHub stars: LangChain (148K), MetaGPT (71K), AutoGen (61.5K), CrewAI (60K).\"",
      "source_type": "independent",
      "credibility": "Independent framework tracker, same dated snapshot as E1",
      "support_relation": "supports"
    },
    {
      "evidence_id": "E3",
      "question_id": "RQ1",
      "claim": "The 2026 open-source agent-framework field is concentrated in roughly nine frameworks developers are 'actually using... and building production systems with', including AutoGen (55.4K stars, +1,982 in 6 months), CrewAI (45.7K, +2,540), Google ADK (18.3K, +1,900 in only 11 months of age), LangGraph (26.1K, +2,351), OpenAI Agents SDK (19.7K, +1,554 in 12 months), Pydantic AI (15.4K, +996), LlamaIndex (47.6K, +1,183), Smolagents (25.9K, +1,018).",
      "source_title": "Nine Agent Frameworks, Compared with Data and Code",
      "source_url": "https://blog.mikegchambers.com/posts/agentic-framework-landscape/",
      "publisher": "Mike G Chambers (blog)",
      "publication_date": "unknown",
      "retrieved_evidence": "\"Nine frameworks made this list. Not because they're the only ones, but because they're the ones developers are actually using, talking about, and building production systems with. [table] AutoGen 55.4K 31 +1,982 MIT + CC-BY-4.0 Microsoft CrewAI 45.7K 28 +2,540 MIT CrewAI Inc Google ADK 18.3K 11 +1,900 Apache-2.0 Google LangGraph 26.1K 31 +2,351 MIT LangChain ... OpenAI Agents SDK 19.7K 12 +1,554 MIT OpenAI Pydantic AI 15.4K 21 +996 MIT Pydantic\"",
      "source_type": "independent",
      "credibility": "Independent practitioner blog; star-growth table useful for 6-month deltas. Note: absolute star counts lag live API values (LangGraph shown 26.1K vs 43.8K live 2026-10-24) — used here for growth deltas, not absolute counts",
      "support_relation": "supports"
    },
    {
      "evidence_id": "E4",
      "question_id": "RQ1",
      "claim": "In Stack Overflow's April 2026 pulse survey of roughly 1,100 developers, adoption was LangChain 22%, OpenClaw 17%, LangGraph 14%.",
      "source_title": "Top Agent Frameworks To Use in 2026: A Comparison",
      "source_url": "https://www.splunk.com/en_us/blog/learn/agent-frameworks.html",
      "publisher": "Splunk",
      "publication_date": "unknown",
      "retrieved_evidence": "\"Adoption data is thin. Stack Overflow's April 2026 pulse survey of roughly 1,100 developers put LangChain at 22% adoption, OpenClaw at 17% and LangGraph at 14%.\"",
      "source_type": "independent",
      "credibility": "Splunk (Cisco) is not an agent-framework vendor; cites a named third-party survey (Stack Overflow pulse, April 2026, n≈1,100)",
      "support_relation": "supports"
    },
    {
      "evidence_id": "E5",
      "question_id": "RQ2",
      "claim": "Agent frameworks appear in only 18% of organizations running LLM applications, up from 9% a year earlier — organizational penetration roughly doubled year over year.",
      "source_title": "Top Agent Frameworks To Use in 2026: A Comparison",
      "source_url": "https://www.splunk.com/en_us/blog/learn/agent-frameworks.html",
      "publisher": "Splunk",
      "publication_date": "unknown",
      "retrieved_evidence": "\"Additional research suggests agent frameworks appear in only 18% of organizations running LLM applications, up from nine percent a year earlier, which means roughly four in five teams are still building without one.\"",
      "source_type": "independent",
      "credibility": "Same page as E4; 'additional research' not named on the page — provenance of the underlying study is thin (carried as a caveat into stage 03)",
      "support_relation": "supports"
    },
    {
      "evidence_id": "E6",
      "question_id": "RQ1",
      "claim": "Microsoft retired AutoGen and debuted Agent Framework as its sole orchestration/agent framework; AutoGen and Semantic Kernel remain in maintenance mode.",
      "source_title": "Microsoft retires AutoGen and debuts Agent Framework to unify and govern enterprise AI agents",
      "source_url": "https://venturebeat.com/orchestration/microsoft-retires-autogen-and-debuts-agent-framework-to-unify-and-govern",
      "publisher": "VentureBeat",
      "publication_date": "unknown",
      "retrieved_evidence": "\"Microsoft released the Agent Framework on public preview, which will now essentially be the company's sole orchestration and agent framework. Microsoft said AutoGen and Semantic Kernel will 'remain in ma[intenance]'... AutoGen acts as the backbone for many enterprise projects, particularly with the release of AutoGen v0.4 in January.\"",
      "source_type": "independent",
      "credibility": "Established tech press; consistent with Microsoft's own migration guide (learn.microsoft.com)",
      "support_relation": "supports"
    },
    {
      "evidence_id": "E7",
      "question_id": "RQ2",
      "claim": "LangChain's public adoption/activity snapshot as of 2026-10-24: PyPI downloads 170,457,766 last month; GitHub 148,335 stars, 24,894 forks, MIT license, pushed 2026-10-24.",
      "source_title": "PyPIStats recent downloads API + GitHub repository API: langchain / langchain-ai/langchain",
      "source_url": "https://pypistats.org/api/packages/langchain/recent",
      "publisher": "pypistats.org; GitHub REST API",
      "publication_date": "unknown",
      "retrieved_evidence": "pypistats.org/api/packages/langchain/recent → {\"last_month\": 170457766, \"last_week\": 37334710}; api.github.com/repos/langchain-ai/langchain → stargazers_count 148335, forks_count 24894, license MIT, pushed_at 2026-10-24T01:56:18Z. Both queried 2026-10-24.",
      "source_type": "primary",
      "credibility": "Primary registry/repository data. PyPI counts include CI and dependent installs (see E17) — treat as an upper bound on direct usage",
      "support_relation": "supports"
    },
    {
      "evidence_id": "E8",
      "question_id": "RQ2",
      "claim": "LangGraph's public adoption/activity snapshot as of 2026-10-24: PyPI downloads 44,769,952 last month; GitHub 43,794 stars, 7,517 forks, 285 contributors, MIT license, pushed 2026-10-24.",
      "source_title": "PyPIStats recent downloads API + GitHub repository API: langgraph / langchain-ai/langgraph",
      "source_url": "https://pypistats.org/api/packages/langgraph/recent",
      "publisher": "pypistats.org; GitHub REST API",
      "publication_date": "unknown",
      "retrieved_evidence": "pypistats.org/api/packages/langgraph/recent → {\"last_month\": 44769952, \"last_week\": 13114431}; api.github.com/repos/langchain-ai/langgraph → stargazers_count 43794, forks 7517, license MIT, pushed_at 2026-10-24T01:54:32Z; contributors count 285 (Link-header pagination count, anon=false). Queried 2026-10-24.",
      "source_type": "primary",
      "credibility": "Primary registry/repository data; same CI-inflation caveat as E7",
      "support_relation": "supports"
    },
    {
      "evidence_id": "E9",
      "question_id": "RQ2",
      "claim": "CrewAI's public adoption/activity snapshot as of 2026-10-24: PyPI downloads 2,442,764 last month; GitHub 60,041 stars, 8,854 forks, 358 contributors, MIT license, pushed 2026-10-24.",
      "source_title": "PyPIStats recent downloads API + GitHub repository API: crewai / crewAIInc/crewAI",
      "source_url": "https://pypistats.org/api/packages/crewai/recent",
      "publisher": "pypistats.org; GitHub REST API",
      "publication_date": "unknown",
      "retrieved_evidence": "pypistats.org/api/packages/crewai/recent → {\"last_month\": 2442764, \"last_week\": 644597}; api.github.com/repos/crewAIInc/crewAI → stargazers_count 60041, forks 8854, license MIT, pushed_at 2026-10-24T01:56:03Z; contributors 358. Queried 2026-10-24.",
      "source_type": "primary",
      "credibility": "Primary registry/repository data",
      "support_relation": "supports"
    },
    {
      "evidence_id": "E10",
      "question_id": "RQ2",
      "claim": "AutoGen's public adoption/activity snapshot as of 2026-10-24: PyPI downloads 379,923 last month (autogen-agentchat) plus 408,564 (autogen-core); GitHub 61,542 stars, 443 contributors, pushed 2026-10-16; GitHub API reports license CC-BY-4.0.",
      "source_title": "PyPIStats recent downloads API + GitHub repository API: autogen-agentchat, autogen-core / microsoft/autogen",